{"contract":"strategy-context-scope","schemaVersion":2,"requestId":"request-synthetic","asOf":"2026-10-17T08:00:00+00:00","data":{"versionId":"strategy-version-synthetic","versionRevision":2,"provenance":"userRecorded","revision":1,"contentHash":"8f7a273161e5a32af073eba4088a37f65fc04a6dc06b4ed738e73e3f685b0819","publicationSequence":3,"knownAtUtc":"2026-10-17T08:00:00+00:00","sessions":{"classification":"selected","ids":["session-version-synthetic"]},"marketConditions":{"classification":"selected","ids":["condition-revision-synthetic"]},"snapshotCursor":"synthetic-scope-receipt"}}
